{
  "schema": "ev4-builder-kernel-decision-receipt@0.1.0",
  "wave": 5,
  "surface": "handoff",
  "receipt_status": "warning",
  "source_of_truth": "machine_readable_decision_trace",
  "source_trace_state": "missing",
  "decision_trace": null,
  "missing_trace_fields": [
    "consumer_stage",
    "evidence_state",
    "evidence_refs",
    "rejected_options",
    "selected_option",
    "decision_card_ref",
    "decision_family"
  ],
  "receipt_text": "⚠️ این Builder action هنوز رسید معتبر کرنل ندارد؛ بدون machine-readable trace کامل نباید به‌عنوان تصمیم اجرایی معتبر عبور کند.",
  "wave_boundary": "presentation_layer_only",
  "non_claims": {
    "builder_design_authority_claimed": false,
    "builder_execution_proof_claimed": false,
    "downstream_enforcement_claimed": false,
    "production_readiness_claimed": false,
    "enforcement_status_upgrade_claimed": false
  }
}
