{
  "schema": "ev4-builder-kernel-decision-receipt@0.1.0",
  "wave": 5,
  "surface": "fallback",
  "receipt_status": "fallback_warning",
  "source_of_truth": "machine_readable_decision_trace",
  "source_trace_state": "missing",
  "decision_trace": null,
  "missing_trace_fields": [
    "decision_family",
    "decision_card_ref",
    "selected_option",
    "rejected_options",
    "evidence_refs",
    "evidence_state",
    "consumer_stage"
  ],
  "receipt_text": "⚠️ fallback اجرا شد، اما تصمیم جدید محسوب نمی‌شود؛ برای انتخاب جایگزین، decision trace معتبر لازم است.",
  "wave_boundary": "presentation_layer_only",
  "non_claims": {
    "builder_design_authority_claimed": false,
    "builder_execution_proof_claimed": false,
    "downstream_enforcement_claimed": false,
    "production_readiness_claimed": false,
    "enforcement_status_upgrade_claimed": false
  }
}
